{
  "analysis": {
    "id": "structural-canonical-observation",
    "version": "1"
  },
  "artifactHash": "sha256:99191b71925f32148df5c15af513b735f866e6ee8b1eac57371ab9758249745a",
  "evaluation": "measured",
  "implementation": {
    "attributes": "excluded",
    "contentHash": "sha256:c24eb843608db1252a279b2f48f717f13d675680cd7607cec6d46d84c26d9a4d",
    "id": "canonical-directed-observation-v1",
    "inputOrdering": "source-id-ascending",
    "kernelCanonicalSchemaVersion": "1",
    "kernelOperation": "canonicalizeCandidate",
    "valueEncoding": "node-count-and-canonical-directed-endpoints",
    "version": "1",
    "witnessMeaning": "one-isomorphism-not-canonical-orbits"
  },
  "observation": {
    "implementation": {
      "contentHash": "sha256:c24eb843608db1252a279b2f48f717f13d675680cd7607cec6d46d84c26d9a4d",
      "id": "canonical-directed-observation-v1",
      "version": "1"
    },
    "observable": {
      "contentHash": "sha256:48f137781781c54724e172256925e44c9a2be42a08610c88abaca8a9f6016e7b",
      "id": "canonical-directed-structure-v1",
      "version": "1"
    },
    "regime": {
      "contentHash": "sha256:9276d8ad6a0d6e872783a79af4de63727b6452b42db1928ffc9f20111d86a97c",
      "id": "canonical-structure-v1",
      "version": "1"
    },
    "value": {
      "edges": [],
      "nodeCount": 1
    },
    "valueHash": "sha256:d5492402ce8492fbe44567df01827d14ae8d9c20ae95c2c74adcf758f6aac9d1"
  },
  "preparation": {
    "analysis": {
      "id": "structural-regime-preparation",
      "version": "1"
    },
    "artifactHash": "sha256:689a2b5b083f3ac78c62913c9a8f8699f7406cfd7a39fc3eb562694b0a536f3b",
    "context": {
      "contextHash": "sha256:32b6cc2801e7bb58559f16067872554f238ce7fb483d8d847fa2faac002a099e",
      "dictionaryHash": "sha256:c7cd166f910f4e619ad8fbf7d2ef37c7d4d9decd7f6340899bcd28cdf679c1d9",
      "model": {
        "manifestHash": "sha256:7ff830c6437b7da9aa8cb438f9527c63dcc49b26b0724e82877d55b619e3257f",
        "modelId": "canonical-singleton",
        "modelRootHash": "sha256:d885b1a3024af4da2daf39d8bd555481f082b80abec36c38f5f2fcebc754e1c3",
        "modelVersion": "1"
      },
      "normalizationContext": "full-source-projection",
      "projectionPolicyHash": "sha256:25f5cdb778b7fdf05ff071dd9d8c672a9726ca50958a6192066e72a8523172d1",
      "schemaVersion": "1",
      "sourceProjectionHash": "sha256:a63afbc2463dad58e64fb3778565093bda0bd216577a8dc4bc7779cca6e5b954"
    },
    "evaluation": "not-run",
    "observableSpecs": [
      {
        "contentHash": "sha256:48f137781781c54724e172256925e44c9a2be42a08610c88abaca8a9f6016e7b",
        "definition": "Canonical directed adjacency including isolated nodes, modulo node relabeling; all source attributes excluded.",
        "id": "canonical-directed-structure-v1",
        "mandatory": true,
        "normalization": "none",
        "requiredEvidence": [
          "verified-scoped-directed-projection"
        ],
        "schemaVersion": "1",
        "scope": "whole-scoped-directed-graph",
        "supplier": {
          "contentHash": "sha256:79e2978d134774168a5b534027caeb6709fe3ae8d18a97af21118982d07fb62e",
          "definition": "Canonical directed adjacency including isolated nodes, modulo node relabeling; all source attributes excluded.",
          "id": "structural-canonical-observation-v1",
          "operation": "canonical-directed-structure-v1",
          "version": "1"
        },
        "units": "discrete-structure",
        "valueType": "canonical-directed-graph",
        "version": "1"
      }
    ],
    "regime": {
      "aggregationPolicy": {
        "completeDifferentStatus": "distinguishable-under-regime",
        "completeEqualStatus": "indistinguishable-under-regime",
        "contentHash": "sha256:b736a798a746914cbbcb1ca38fd90f265fb33288c9b4d29619bb2c977bd0ccaf",
        "distanceConstruction": "deferred-to-comparison-contract",
        "id": "exact-profile-equality-v1",
        "intervals": "unsupported",
        "numericPolicy": "exact-discrete",
        "tolerance": "none",
        "version": "1"
      },
      "contentHash": "sha256:9276d8ad6a0d6e872783a79af4de63727b6452b42db1928ffc9f20111d86a97c",
      "id": "canonical-structure-v1",
      "invariancePolicy": {
        "actsOn": "scoped-graph-with-transported-scope-membership",
        "contentHash": "sha256:8d129f942e399ea18826590ba932a9a80b9eb4eb4a321dfa4fb6eefee8a8c002",
        "id": "structural-relabeling-invariances-v1",
        "probeExecution": "not-implied-by-declaration",
        "provenanceHashes": "may-change",
        "transformations": [
          "record-order",
          "bijective-node-id-renaming",
          "bijective-edge-id-renaming",
          "presentation-only-changes"
        ],
        "version": "1"
      },
      "limits": {
        "maxArtifactBytes": 1048576,
        "maxCanonicalEntries": 100000,
        "maxEdges": 30,
        "maxNodes": 6,
        "maxReachabilityPairVisits": 0,
        "maxSearchStates": 100000,
        "minNodes": 1
      },
      "matchingPolicy": {
        "algorithm": "kernel-canonicalizeCandidate",
        "candidateTranslation": {
          "domain": "single-candidate",
          "edgeAttributes": [],
          "edgeRole": "source-parent",
          "nodeAttributes": [],
          "nodeRef": "sha256:33c6a7c3f6336627a0abdcd75cde0e59a81e7e5353723bac2d3a35df1c89cbde"
        },
        "contentHash": "sha256:6b0b78c73b1293e2f72f80607c5dea086df4a248f39e78ec462467b13923809e",
        "direction": "preserved",
        "disconnectedGraphs": "allowed",
        "edgeMatching": "mapped-ordered-endpoints",
        "equivalence": "directed-graph-isomorphism",
        "exhaustion": "error-no-heuristic-identity",
        "graphPolicy": {
          "allowParallelEdges": false,
          "allowSelfLoops": false,
          "connected": false,
          "connectivityProjection": "directed-weak",
          "structuralEdgeAttributes": [],
          "structuralNodeAttributes": []
        },
        "id": "directed-candidate-matching-v1",
        "nodeMatching": "all-bijections",
        "sourceIdentifiers": "provenance-only",
        "version": "1"
      },
      "missingnessPolicy": {
        "contentHash": "sha256:b2bdf91b18bc4da156f9e8f49977e1f59d55e32712baeb3fadb1f8bdcb66e7c8",
        "coverage": "per-component-with-reasons",
        "emptyProfile": "indeterminate",
        "id": "strict-indeterminate-v1",
        "incompleteDistance": null,
        "incompleteStatus": "indeterminate",
        "invalidArtifact": "validation-error",
        "mandatoryGaps": [
          "missing",
          "unavailable",
          "rejected",
          "unresolved"
        ],
        "observedDifferences": "retain-as-diagnostics",
        "partialDistance": "not-supported",
        "version": "1"
      },
      "observables": [
        {
          "contentHash": "sha256:48f137781781c54724e172256925e44c9a2be42a08610c88abaca8a9f6016e7b",
          "id": "canonical-directed-structure-v1",
          "version": "1"
        }
      ],
      "probeSets": {
        "invariance": {
          "contentHash": "sha256:aef895be35a566818dc1be7a75be99cee6f3678b7cabc5bdcf48c5dff4ade705",
          "execution": "none",
          "id": "empty-invariance-probe-set-v1",
          "probes": [],
          "version": "1"
        },
        "response": {
          "contentHash": "sha256:88406c5d44694471e7ae217b6811d3b4e8fb74b11b86269fd777c2323e1a6326",
          "execution": "none",
          "id": "empty-response-probe-set-v1",
          "probes": [],
          "version": "1"
        }
      },
      "projectionPolicy": {
        "contentHash": "sha256:25f5cdb778b7fdf05ff071dd9d8c672a9726ca50958a6192066e72a8523172d1",
        "id": "source-parent-directed-v1",
        "version": "1"
      },
      "schemaVersion": "1",
      "scopePolicy": {
        "boundary": "partition-incoming-outgoing-external-edges",
        "contentHash": "sha256:93ae51edd5049b84399b0483423e21cc67b9f78778bffee279ef5f256e6b5671",
        "edges": "both-endpoints-in-scope",
        "id": "verified-source-induced-scope-v1",
        "implicitTruncation": "forbidden",
        "isolatedNodes": "retained",
        "membership": "explicit-node-set-or-full-source",
        "sourceVerification": "complete-model-before-scoping",
        "version": "1"
      },
      "version": "1",
      "vocabularyPolicy": {
        "contentHash": "sha256:2b8dd35f9ca28b70cd60065e86f004b10ce63b2a3d093956bdba9af20b0b7e72",
        "id": "untyped-vocabulary-v1",
        "meaning": "excluded-from-observations",
        "version": "1"
      }
    },
    "request": {
      "regimeId": "canonical-structure-v1",
      "scope": {
        "kind": "full"
      }
    },
    "schemaVersion": "1",
    "scope": {
      "edgeIds": [],
      "externalEdgeIds": [],
      "incomingBoundaryEdgeIds": [],
      "kind": "full",
      "nodeIds": [
        "n0"
      ],
      "outgoingBoundaryEdgeIds": [],
      "scopeHash": "sha256:575af7612f70a20c110f259af8acdd1d531c0fca0f24d08bce181784a9128515",
      "sourceEdgeCount": 0,
      "sourceNodeCount": 1,
      "sourceProjectionHash": "sha256:a63afbc2463dad58e64fb3778565093bda0bd216577a8dc4bc7779cca6e5b954"
    }
  },
  "schemaVersion": "1",
  "witness": {
    "candidateHash": "sha256:88ec195f5ced480888464e4c8f48a36578c27e37547b96abc0a31f7c918d10f9",
    "edges": [],
    "nodes": [
      {
        "canonicalNode": 0,
        "sourceNodeId": "n0"
      }
    ],
    "skeletonHash": "sha256:396b3d64801cc5c9119f6a7b12a33319e1e2324a5b1406c95b35bc33851a51b7",
    "statistics": {
      "leaves": 2,
      "refinementRounds": 1,
      "searchStates": 2
    }
  }
}
